{
  "schema_version":"data-contract/1.0.0",
  "data_version":"synthetic-base/1.0.0",
  "golden_version":"golden/1.0.0",
  "seed":20260713,
  "warehouse_id":"WH-CENTRAL-01",
  "historical_week_starts":["2026-04-13","2026-04-20","2026-04-27","2026-05-04","2026-05-11","2026-05-18","2026-05-25","2026-06-01","2026-06-08","2026-06-15","2026-06-22","2026-06-29","2026-07-06","2026-07-13","2026-07-20","2026-07-27"],
  "forecast_week_starts":["2026-08-03","2026-08-10","2026-08-17","2026-08-24"],
  "assets":[
    {"path":"fixtures/category_policies.json","role":"BASE_FIXTURE","record_count":6},
    {"path":"fixtures/warehouse.json","role":"BASE_FIXTURE","record_count":1},
    {"path":"fixtures/historical_weekly_category_flow.json","role":"BASE_FIXTURE","record_count":96},
    {"path":"fixtures/planned_inbound.json","role":"BASE_FIXTURE","record_count":19},
    {"path":"fixtures/pending_donation_offers.json","role":"BASE_FIXTURE","record_count":2},
    {"path":"fixtures/candidate_actions.json","role":"BASE_FIXTURE","record_count":19},
    {"path":"fixtures/evidence_records.json","role":"BASE_FIXTURE","record_count":18},
    {"path":"fixtures/scenarios/scenario_a.json","role":"SCENARIO_OVERLAY","record_count":1},
    {"path":"fixtures/scenarios/scenario_b.json","role":"SCENARIO_OVERLAY","record_count":1},
    {"path":"fixtures/scenarios/scenario_c.json","role":"SCENARIO_OVERLAY","record_count":1},
    {"path":"fixtures/scenarios/scenario_d.json","role":"SCENARIO_OVERLAY","record_count":1},
    {"path":"fixtures/scenarios/scenario_e.json","role":"SCENARIO_OVERLAY","record_count":1},
    {"path":"golden/scenario_a.golden.json","role":"GOLDEN_ORACLE","record_count":1},
    {"path":"golden/scenario_b.golden.json","role":"GOLDEN_ORACLE","record_count":1},
    {"path":"golden/scenario_c.golden.json","role":"GOLDEN_ORACLE","record_count":1},
    {"path":"golden/scenario_d.golden.json","role":"GOLDEN_ORACLE","record_count":1},
    {"path":"golden/scenario_e.golden.json","role":"GOLDEN_ORACLE","record_count":1}
  ],
  "scenario_ids":["SCN-A-USDA-PROTEIN-DELAY","SCN-B-SHORT-LIFE-PRODUCE","SCN-C-SNACK-MISMATCH","SCN-D-BUDGET-TRADEOFF","SCN-E-DATA-CONFLICT"],
  "hash_policy":"RUNTIME_SHA256_OF_CANONICAL_JSON",
  "provenance":{"mode":"SYNTHETIC","created_by":"NourishOps build-context team","description":"Manifest for the immutable base fixtures, five overlays, and five golden oracles."}
}
